{"record_id":"DPR-warn-0001","profile_id":"ACA-DPR-BASELINE-0.1","rule_version":"0.1.0","evaluated_at":"2026-08-02T00:00:00Z","state":"ALLOW","predicates":[{"id":"subject.identified","value":"TRUE","source":"subject-registry","evidence_hash":"sha256:subject"},{"id":"source.traceable","value":"TRUE","source":"evidence-index"},{"id":"authority.valid","value":"TRUE","source":"authority-registry","evidence_hash":"sha256:authority"},{"id":"temporal.valid","value":"TRUE","source":"event-ledger","evidence_hash":"sha256:time"},{"id":"notice.meaningful","value":"TRUE","source":"notice-record","evidence_hash":"sha256:notice"},{"id":"contestability.available","value":"TRUE","source":"review-policy","evidence_hash":"sha256:contest"},{"id":"remedy.actor_identified","value":"TRUE","source":"remedy-registry","evidence_hash":"sha256:remedy"}],"remedy":{"status":"AVAILABLE","route":"review-office","deadline":null}}
