{"record_id":"DPR-pass-0001","profile_id":"ACA-DPR-BASELINE-0.1","rule_version":"0.1.0","evaluated_at":"2026-08-02T00:00:00Z","state":"ALLOW","predicates":[{"id":"subject.identified","value":"TRUE","source":"subject-registry","evidence_hash":"sha256:1111111111111111111111111111111111111111111111111111111111111111"},{"id":"source.traceable","value":"TRUE","source":"evidence-index","evidence_hash":"sha256:2222222222222222222222222222222222222222222222222222222222222222"},{"id":"authority.valid","value":"TRUE","source":"authority-registry","evidence_hash":"sha256:3333333333333333333333333333333333333333333333333333333333333333"},{"id":"temporal.valid","value":"TRUE","source":"event-ledger","evidence_hash":"sha256:4444444444444444444444444444444444444444444444444444444444444444"},{"id":"notice.meaningful","value":"TRUE","source":"notice-record","evidence_hash":"sha256:5555555555555555555555555555555555555555555555555555555555555555"},{"id":"contestability.available","value":"TRUE","source":"review-policy","evidence_hash":"sha256:6666666666666666666666666666666666666666666666666666666666666666"},{"id":"remedy.actor_identified","value":"TRUE","source":"remedy-registry","evidence_hash":"sha256:7777777777777777777777777777777777777777777777777777777777777777"}],"remedy":{"status":"AVAILABLE","route":"review-office","deadline":null}}
